AgentRecordingSessionID,pcs_consensus_score,pcs_consensus_rationale,nps_consensus_score,nps_consensus_rationale,pcs_score,pcs_class,pcs_rationale,nps_score,nps_class,nps_rationale,hyde_mode_pcs,hyde_mode_nps,n_chunks,n_tree_nodes,is_long,token_count,processing_time_s,stage1_llm_tokens,stage3_llm_tokens,stage5_pcs_llm_tokens,stage5_nps_llm_tokens,stage7_pcs_llm_tokens,stage7_nps_llm_tokens,total_llm_tokens,stage_times,pcs_error,nps_error
BBAA343872A9C44692EFA8DD901F569D,3,"Interrupting the caller (“I was talking, go ahead,” seq. 22) undermined professionalism.
Failed to show empathy or acknowledge the customer’s frustration.
Did not attempt escalation or offer alternative resolution paths.
Closing was perfunctory and inappropriate given the customer’s hostility (“I hope you have a great rest of your day,” seq. 40).
Overall, the agent followed process but did not de-escalate or manage the customer’s anger, leaving the situation worse. | Agent was able to explain the bill outstanding the the reason it was past due, was not able to handle the customer and kept repeating about the process that cannot cancel till the past due is paid, this aggregated the customer more, no empathy observed",2,"Detractor: [turns 23, 29, 32] Customer is irate because as per him he doesn't owe any amount and has wasted 12 hours on this issue and wants to close his account | The caller became hostile, saying he had “12 hours into this” and wanted to cancel the account (seq. 29).
He accused Spectrum of lying and refused to pay further (seq. 32, 39).
The call ended unresolved, with the customer angry and intent on leaving Spectrum. | Detractor: [turns 23] Customer not happy as do not agree with the past due balance, Detractor: [turns 29, 32] Customer was furious and wanted to cancel, feels he was lied to,",5,Neutral,"The agent accurately explained the billing situation and payment math, noting that ""your balance was 12890"" and the partial payment left a remaining balance ('Your remaining balance at the time of that payment was 6895') which correctly addressed the customer's dispute (lines 17-18, 24-27). The agent also clearly stated process limitations about closing service while an interruption/order is open ('We can't close it while there's a past due balance and a service interruption') and the requirement to pay the past due to cancel immediately (lines 30, 34-36). However, the agent did not demonstrate empathy or attempt de-escalation while the customer was upset ('You lied to me' / agent responds with a brief closing), and the tone/closure felt abrupt rather than conciliatory (lines 39-40). Overall the handling was factually correct and within scope but lacked supportive communication, so the interaction is rated neutral (score 5).",2,Detractor,"The caller expresses strong negative sentiment and intent to sever relationship with Spectrum, stating 'Just cancel the account. We don't want to do Business with you anymore.' ('Just cancel the account. We don't want to do Business with you anymore.' - line 29). The caller accuses Spectrum of dishonesty: 'You lied to me' ('You lied to me and so I'm not going to pay any more. We're done.' - line 39), and repeatedly refuses further payment ('We're not going to pay anymore.' - line 32; 'If you can't cancel the $89.00, then we're not going to do.' - line 37). These statements indicate strong negative feelings that would likely deter referrals and harm the brand if shared. The dispute over whether the balance was 'current' ('She assured me it was current so I don't owe the $89.00.' - line 23) shows the source of the complaint but does not mitigate the caller's clear decision to stop service and pay, supporting a strong negative score of 2 under the rubric.",calibrated,calibrated,6,6,False,1063,3.75,1947,0,0,0,3878,3769,9594,"{""1_preprocess"": 92.01480627059937, ""2_embed_chunks"": 4.263944149017334, ""3_raptor"": 33.30880045890808, ""4_embed_raptor"": 0.15165352821350098, ""5a_hyde_pcs"": 0.5594143867492676, ""6a_search_pcs"": 0.025899648666381836, ""7a_rationale_pcs"": 184.74514269828796, ""5b_hyde_nps"": 0.6748034954071045, ""6b_search_nps"": 0.02574753761291504, ""7b_rationale_nps"": 434.5282139778137}",,
BF3829C6B93EFA45A08D9C7645A1DF6B,8,"Positive: [turns 52, 82] Agent clearly explained the breakup of the bill and also sent the emails that the customer claims not to have received | Customer was calling about the phone service as it was shut off. Agent educated customer that in order to get the phone service running customer needed to make payment for the past due. Agent listened to the customer patiently. Agent was professional even when customer was cursing. Agent understood the customer's request and showed empathy.",0,"Customer expressed anger and hostility, showing severe dissatisfaction with service.” Customer escalated with abusive remarks, reflecting severe dissatisfaction and anger.” Customer repeatedly disputed her bills however issue has never been resolved. Caller left extremely dissatisfied. | Detractor: [turns 4, 7] Cx seems unhappy as their phone had been disconnected. Turn-89 Customer complained about the last agent. Turn-127 Cx wanted their phone service back and said their bill is freaking $50. Turn 132 - cx complained that Spectrum person told them it is for free however they were charged for it, Turn -134- Cx don't want to pay their bill. Turn-139 Customer was highly distressed with their increased bill. Cx was abusive on call and seems highly distressed with the bill. | Customer was calling about his phone service and the bill. Customer was very frustrated and wanted the phone service to be turned on. Agent educated customer about the balance on the account. Customer said that he doesn't have money. Customer was upset throughout the call and kept cursing.",6,Neutral,"The agent successfully resolved account access and reset the PIN ('1225' was set) and resent billing emails, showing useful, procedural help ('I just resent that'). The agent clearly explained scope and system limits when they could not restore service or waive the past-due balance ('it is an automated system...the only way to get your phone on'), which is correct handling within jurisdiction. The agent remained professional and restrained with empathy but asked the caller to stay professional during profanity ('If you'd like me to help you, you need to like, stay professional'), and offered alternatives (downgrade, My Spectrum app). Because the core billing/service suspension was not resolved but the agent routed and communicated limitations appropriately, this fits a solid, routine handling score in the neutral range with competent communication and ownership for what they could control ('when that 6377 gets wiped out').",2,Detractor,"The caller is strongly negative about Spectrum after the call and is unlikely to recommend them. He repeatedly expresses anger and profanity toward the company, e.g. ('Oh we can't help you, Fuck you. Fuck your past due bill and your auto pay shit.') (line 194-195), and says he 'can't deal with this little bullshit' and is overwhelmed ('I don't have time for this. I don't. I don't. I can't deal with this little bullshit.') (line 238). The core issues remain unresolved and the agent repeatedly states limits to what they can do (automated turn-off requiring the past-due balance to be zeroed: 'the only way to get your phone on is that past due balance has to be zeroed out' and 'there's nothing I can do' ) (lines 124-126, 226-227), which reinforces the caller's frustration. The caller also feels misled by prior sales/promotions and billing surprises ('I had a fiber gig... the freaking Spectrum person told me, Brian, it's for free... I'm like, OK, so now when I tell you these things, do you feel like, oh, here, let me ramrod these new prices right down your freaking throat again') (line 132) and ('I didn't even know my bill was due, for God's sakes.') (line 145). Because the conversation leaves billing and suspension disputes unresolved, the caller is likely to actively detract from Spectrum rather than remain neutral or passive. ('I ain't left you guys. I'd like you guys one way or another. I should be motherfucking royalty.' / 'You, you fucking pissed me off. Fuck it, I don't even care.') (lines 251-255). Overall sentiment is strongly negative and forward-looking—warranting a Detractor rating of 2.  

Cited evidence: ('Oh we can't help you, Fuck you. Fuck your past due bill and your auto pay shit.'), ('I don't have time for this. I don't. I don't. I can't deal with this little bullshit.'), ('the only way to get your phone on is that past due balance has to be zeroed out'), ('there's nothing I can do'), ('the freaking Spectrum person told me, Brian, it's for free'), ('I didn't even know my bill was due, for God's sakes.'), ('You, you fucking pissed me off. Fuck it, I don't even care.')  

(Note: quoted phrases correspond to transcript lines cited below.)  

Citations: [194, 195, 238, 124, 125, 126, 226, 227, 132, 145, 251, 253, 254, 255]",calibrated,calibrated,17,23,True,5827,3.75,6327,7427,0,0,8796,10034,32584,"{""1_preprocess"": 92.01480627059937, ""2_embed_chunks"": 4.263944149017334, ""3_raptor"": 33.30880045890808, ""4_embed_raptor"": 0.15165352821350098, ""5a_hyde_pcs"": 0.5594143867492676, ""6a_search_pcs"": 0.025899648666381836, ""7a_rationale_pcs"": 184.74514269828796, ""5b_hyde_nps"": 0.6748034954071045, ""6b_search_nps"": 0.02574753761291504, ""7b_rationale_nps"": 434.5282139778137}",,
C28EBA690790AA43868960D5386ED559,6,Positive: [turn 3] - agent summarize the issue inform as caller is not the authorized user can't help her since the issue is not resolved also nowhere on the call agent shows empathy. | Caller was calling about internet issue and was using profanity. Agent listened to the customer patiently and asked for authorized user. Agent had to release the call as authorized user was not on the call and caller kept using bad words.,1,"Customer expressed anger and hostility, showing severe dissatisfaction with service. Caller left aggravated and unsettled. Issue remained unresolved. Customer demonstrated abusive behavior and voiced strong rejection of support experience. | Customer was calling to complain about internet issue. Caller was not the authorized user on the account. Caller was very upset and kept using profanity. Agent had to release the call.",6,Neutral,"Agent correctly stated the account limitation: 'I would need to speak to the account holder to be able to get into the account' and repeatedly asked the caller to have the account holder call back, which is appropriate for jurisdictional limits ('I would need to speak to the account holder...' (turns 31-35)). The agent remained professional and set boundaries when the caller swore, saying 'that's enough. I'd like to keep this professional' (turn 38), showing de-escalation effort. The agent did not offer alternative next steps beyond asking the account holder to call, and the issue was not resolved on this call, so the handling is competent but routine rather than above-standard ('when the account holder is available, definitely have her call in and we can definitely assist' (turn 42)). Overall the agent followed process and maintained professionalism but provided limited options, so a neutral score is appropriate ('Again, when the account holder calls in, we can definitely make those changes on the account.' (turn 45)).",2,Detractor,"The caller is clearly highly dissatisfied and hostile toward Spectrum after an unresolved service/equipment issue: they report a failing device ('The Wi-Fi 7 router is overheating.') (lines 4) and explicitly request replacement hardware ('I want you to send me a replacement hardware.') (line 34). The caller repeatedly uses strong profanity and expresses intent to cancel service ('I was pissed last year and I want to cancel the service for the fucking Spectrum God damn phone service.') (line 43), indicating strong negative sentiment. The agent was unable to help because the account holder was not on the line, which intensified the caller's frustration ('I don't, I don't want you to get into the account.' / 'I want you to send me a replacement hardware.' and agent: 'I would need to speak to the account holder') (lines 33-35, 31). The caller blames Spectrum for poor communication and lack of action ('they're not even aware of this... this is your job to fill them in') (line 48) and uses profanity to describe their situation ('this is what I'm fucking shit left with.') (line 37), reinforcing a strong negative view. Given the combination of unresolved technical issues, explicit cancellation threat, and repeated profanity/anger directed at Spectrum, this caller will very likely detract from the brand after the call. (Supporting evidence: 'How the hell would I be having a good day...' (line 2); 'So I can goddamn throw it out the window.' (line 41); agent closing the call without resolution 'I'm going to go ahead and let go of this call' (line 49).)""  ,  ""citations"": [2,4,34,43,33,35,31,48,37,41,49]",calibrated,calibrated,7,7,False,880,3.75,1281,0,0,0,3446,3338,8065,"{""1_preprocess"": 92.01480627059937, ""2_embed_chunks"": 4.263944149017334, ""3_raptor"": 33.30880045890808, ""4_embed_raptor"": 0.15165352821350098, ""5a_hyde_pcs"": 0.5594143867492676, ""6a_search_pcs"": 0.025899648666381836, ""7a_rationale_pcs"": 184.74514269828796, ""5b_hyde_nps"": 0.6748034954071045, ""6b_search_nps"": 0.02574753761291504, ""7b_rationale_nps"": 434.5282139778137}",,
004D797ABD3FD345A62836ABB7CCB766,8,"Agent showed empathy and shared precise details with customer. All this built trust and satisfaction. | Positive: [turn 3] Agent empathizes with the customer. Agent informed that they had Spectrum Internet Assist Positive: [turns 18 19] Agent informed that they are renting the equipment's and could save money having their own equipment, Agent informed when the bill is due shared billing details for mobile, Turn-70 Cx appreciated the agent",5,"Customer is dissatisfied as his bill is going up and he is on a fixed income thereby inclined towards Detractor | Detractor: [turn 2 21] cx was not happy as the bill keeps going up and they are on fixed income, cx was dis-satisfied with the price increase.",6,Neutral,"The agent provided accurate billing details and due dates, confirming the internet charge and due date ('it's due on the 19th of each month, so this Bill 's paid') and the phone balances ('you got a current balance of 88 5' / 'that was $88.05'). The agent explained why charges rose and identified equipment rental fees with clear options to save money ('you could buy yourself some equipment... router... $10.00... extender... $5.00 a month' and 'equipment actually went up in Price'). Interaction was professional and clear but routine, with limited empathy or proactive cost-saving assistance beyond explaining options, so the handling is competent but not exceptional. The call ended with a polite recap and closure ('Certainly glad we could recap those balances and I Hope you have a great day').",6,Detractor,"The caller expresses concern about rising costs: 'Why does it keep going up? I mean it just seems like.' ('Why does it keep going up? I mean it just seems like.') and the agent confirms small equipment increases: 'Yeah, it looks like the equipment actually went up in Price.' ('Yeah, it looks like the equipment actually went up in Price.') which indicates frustration with rate increases. The caller also emphasizes they are on the cheapest plan and focused on cost: 'So all I do is watch TV on Netflix. So that's the cheapest plan.' ('So all I do is watch TV on Netflix. So that's the cheapest plan.') and clarifies the monthly charge ' $40.47.' ('$40.47.'), showing sensitivity to price. The interaction ends politely with appreciation—'I apreciated.' ('I apreciated.') and 'Thank you very much, you too. Bye bye.' ('Thank you very much, you too. Bye bye.')—indicating no strong enthusiasm, just relief at getting answers. Overall the sentiment is not positive enough to be a promoter or passive; the caller remains concerned about recurring price increases and could share that negative impression with others, so this maps to a score of 6 (mostly neutral but potentially damaging). Every claim above is supported by the cited transcript lines.",calibrated,calibrated,7,7,False,799,3.75,1360,0,0,0,3392,3419,8171,"{""1_preprocess"": 92.01480627059937, ""2_embed_chunks"": 4.263944149017334, ""3_raptor"": 33.30880045890808, ""4_embed_raptor"": 0.15165352821350098, ""5a_hyde_pcs"": 0.5594143867492676, ""6a_search_pcs"": 0.025899648666381836, ""7a_rationale_pcs"": 184.74514269828796, ""5b_hyde_nps"": 0.6748034954071045, ""6b_search_nps"": 0.02574753761291504, ""7b_rationale_nps"": 434.5282139778137}",,
005D0403727B02429312760DDDF5D5A1,6,"Agent did not provide payment extension no positive or negative sentiment observed | Although agent explained the customer about the past due amount and their billing cycle however it seems to be a transactional hence marked as Neutral | The agent clarified billing at Turn 8, offered a solution at Turn 15, and explained the charge increase clearly at Turn 29. While the response at Turn 36 was factual but lacked empathy after caller dissatisfaction, overall handling was professional but not falling at positive side",6,"Caller facing issues while making online payment. Caller was not happy with the hgih bill. | Customer get paid late due to which her service cut off and no extension given to her for bill payment | Customer seems unhappy and wants to change their payment date to avoid service interruption, cx also wants to discuss about their high bill.",6,Neutral,"Agent correctly identified the issue and explained that the promotional year ended: ('yes, it's been a year already, that's why') and broke down the new charges ('$40.00 a month for the actual service and then $18.33 for the phone') (Turns 29-30). The agent apologized for initial confusion when looking at the internet vs. mobile account ('I apologize. I was looking at the internet') and clarified the account in scope (Turns 10-12). The agent clearly stated the restoration requirement and the limits of what they could do: ('the only way we can get it back on is when you pay the 5833') (Turn 36), which is correct but left the customer needing to make payment, so the outcome was unresolved. Overall the handling was professional, clear, and within scope but routine and outcome-dependent, so a solid standard score is appropriate (Turns 15-16, 36).",5,Detractor,"The caller expresses frustration about billing timing and service interruptions: she asks to move her payment because she gets paid on the 4th Wednesday and has had her bill cut off before ('Umm One I wanted to see if there is any way that I can like Move my payment or something.'; 'I get paid on the 4th Wednesday of every month. It makes it really difficult when I go to pay my Bill and it's gotten cut off before'). The agent explains the promotional year ended and charges increased ('your year was up... so it's $40.00 a month for the actual service and then $18.33 for the phone'), which caused the surprise. The caller is denied a payment arrangement to restore service ('the only way we can get it back on is when you pay the 5833'), leaving her with unresolved pain points and only a neutral, resigned response ('OK, I will see what I can do.'). Given the unresolved billing hardship and inability to get accommodation during the call, the interaction would likely detract from Spectrum rather than promote it, so I rate it a 5. ('OK. Yeah, that's what I was wondering. I just, I didn't realize it had been a year already.'; 'OK, I will see what I can do.')  

Litmus test: if shared with others, this call would likely reflect poorly because the customer's problem (billing timing/cutoff) remains unresolved and she was unable to get a payment arrangement to avoid service loss. ('the only way we can get it back on is when you pay the 5833')

Evidence citations support the above points: billing timing and cutoff (lines 6-7), promo ended/price increase (line 29), denial of payment arrangement (line 36), customer's resigned response (lines 37-38). ('Umm One I wanted to see if there is any way that I can like Move my payment or something.'; 'I get paid on the 4th Wednesday of every month. It makes it really difficult when I go to pay my Bill and it's gotten cut off before'; 'OK. Yes, it's been a year already, that's why. And so it's $40.00 a month for the actual service and then $18.33 for the phone.'; 'No, ma'am, the only way we can get it back on is when you pay the 5833'; 'OK, I will see what I can do.')  

Overall: Detractor — 5 (slightly negative/mixed).  

Citations listed below correspond to primary supporting lines from the transcript.



















































































































































































































































































































































































('Umm One I wanted to see if there is any way that I can like Move my payment or something.'; 'I get paid on the 4th Wednesday of every month. It makes it really difficult when I go to pay my Bill and it's gotten cut off before'; 'OK. Yes, it's been a year already, that's why. And so it's $40.00 a month for the actual service and then $18.33 for the phone.'; 'No, ma'am, the only way we can get it back on is when you pay the 5833'; 'OK, I will see what I can do.')",calibrated,calibrated,6,6,False,911,3.75,1404,0,0,0,3538,4379,9321,"{""1_preprocess"": 92.01480627059937, ""2_embed_chunks"": 4.263944149017334, ""3_raptor"": 33.30880045890808, ""4_embed_raptor"": 0.15165352821350098, ""5a_hyde_pcs"": 0.5594143867492676, ""6a_search_pcs"": 0.025899648666381836, ""7a_rationale_pcs"": 184.74514269828796, ""5b_hyde_nps"": 0.6748034954071045, ""6b_search_nps"": 0.02574753761291504, ""7b_rationale_nps"": 434.5282139778137}",,
