AgentRecordingSessionID,pcs_consensus_score,pcs_consensus_rationale,nps_consensus_score,nps_consensus_rationale,pcs_score,pcs_class,pcs_rationale,nps_score,nps_class,nps_rationale,hyde_mode_pcs,hyde_mode_nps,n_chunks,n_tree_nodes,is_long,token_count,processing_time_s,stage1_llm_tokens,stage3_llm_tokens,stage5_pcs_llm_tokens,stage5_nps_llm_tokens,stage7_pcs_llm_tokens,stage7_nps_llm_tokens,total_llm_tokens,stage_times,pcs_error,nps_error
0199B3D5A99E494F91D4755A4A3E4C1A,7,"Positive: [turns 111, 116] Agent properly guided the customer as regards making payment | Positive: [turn 109] Proactively asked if caller want to save card on file. Payment processed smoothly. Agent resolved customer concern efficiently. | Positive: [turn 6] - agent took ownership and take the payment. | Agent updated the email address on the account and updated the card details and processed the payment. Agent informed that it may take upto an hour to get the services back on. Agent helped the customer to make the payment and restore their services hence scored Positive",7,"Called to make payment. Payment done successfully. caller displayed neither enthusiasm nor dissatisfaction. | Customer call to make payment no negative or positive sentiment observed as overall transactional conversation. | Cx calling to make the payment, agent updated the card details and processed the payment. It was transactional conversation throughout the call hence scored Passive | Customer was calling to make a payment. Agent updated the account with the latest phone number and email address. Customer made the payment. There were no identifiable promoter or detractor transcripts on the call.",7,Positive,"The agent successfully completed the payment ('OK, That was successful.' - turn 113) and proactively updated the customer's contact and recovery information to reduce future effort ('All changes made' - turn 66; 'Give me just a second to update it' - turn 53). The agent clearly explained next steps and expected timing for service restoration ('It can take up to an hour to restore services... 10-15 minutes' - turn 116), remained professional and polite throughout, and confirmed the customer's concerns were resolved ('Does that take care of all your concerns for today?' / 'Yes, ma'am.' - turns 118-119). Overall this is above-standard handling but not exceptional, so a 7 is appropriate.  ('Your phone is not listed on the account' - turn 28)  ('I will go ahead and throw that in' - turn 33).",8,Passive,"The caller's issue was a straightforward billing payment request ('I just, I just want to pay my bill.' (4)) and experienced an initial account lookup problem ('your phone is not listed on the account.' (28)). The agent proactively updated the account to make future calls easier ('I will go ahead and throw that in that way you're.' (33)) and confirmed the change to recognize the number ('It'll recognize your number for next time.' (35)). The payment was completed successfully ('OK, That was successful.' (113)) and the agent explained service restoration timing ('It can take up to an hour to restore services.' (116)). The caller ended the call courteously and expressed thanks ('Yes, ma'am. Thank you.' (119)). Overall the problem was resolved with polite, helpful service—no enthusiasm but clear satisfaction—so this reflects mild positive sentiment (score 8, Passive). Citations support resolution and polite tone throughout the call (4, 28, 33, 35, 113, 116, 119).",calibrated,calibrated,6,6,False,1339,3.75,2017,0,0,0,4666,4687,11370,"{""1_preprocess"": 92.01480627059937, ""2_embed_chunks"": 4.263944149017334, ""3_raptor"": 33.30880045890808, ""4_embed_raptor"": 0.15165352821350098, ""5a_hyde_pcs"": 0.5594143867492676, ""6a_search_pcs"": 0.025899648666381836, ""7a_rationale_pcs"": 184.74514269828796, ""5b_hyde_nps"": 0.6748034954071045, ""6b_search_nps"": 0.02574753761291504, ""7b_rationale_nps"": 434.5282139778137}",,
01C15847BA7F464AB935A29290D6CED6,8,"Positive: [turns 9, 20] Agent handled the query efficiently and submitted the ticket letting know that customer does not possess the equipment | They explained the ticket process clearly, reassured the caller, and answered additional questions about email account duration The agent exceeded expectations by reducing customer effort and providing clarity | Customer was calling about missing equipment. Agent checked the details and informed that he submitted a ticket to investigate the missing equipment. Agent educated customer that their team will investigate and resolve the issue.",6,"Detractor: [turn 4] - Customer shows slight dissatisfaction as her husband went to store to return equipment and they ask said there are other additional equipment's as well on account, which according to customer they don't have.",7,Positive,"Agent acknowledged the problem and took ownership by creating an equipment research ticket ('i've got this ticket submitted') and explained the expected timeline ('that usually takes about 48 hours') which resolved the caller's main concern. The agent was professional and polite throughout ('i definitely appreciate you reaching out today' and 'thank you so much for holding'), and answered an additional question about TWC email expiration clearly ('60 Days'). The resolution was within the agent's scope and appropriately routed to research, reducing customer effort and leaving the call closed positively ('i got you all taken care of here today').",8,Passive,"Caller reported an equipment/billing concern ('Umm my husband went in was turning in the uh a modem or router and 2 boxes and to pay the balance on our Bill they told him that we still have a modem ADVR box and 2 boxes' (4)) but the agent offered a clear remediation and submitted an equipment research ticket ('I can certainly get this taken care of here ... i can get a ticket submitted.' (9), 'It's an equipment Research ticket basically letting them know that that equipment 's no longer ...' (11)). The agent completed the action and set expectations ('All right i've got this ticket submitted ... that usually takes about 48 hours ... you should receive an email confirmation' (20)), and the caller expressed appreciation and acceptance of the outcome ('Thank you i really appreciate it' (21); '60 Days OK all right great thank you so much.' (23)). The interaction ended politely with no lingering anger or strong praise ('Nope that's all.' (25); 'i Hope you have a great rest of your day.' (26)). Overall the caller appears satisfied but not enthusiastic—likely to be passive rather than a strong promoter or detractor. ('Bye, bye, bye, bye.' (29)),",calibrated,calibrated,6,6,False,690,3.75,904,0,0,0,2880,3002,6786,"{""1_preprocess"": 92.01480627059937, ""2_embed_chunks"": 4.263944149017334, ""3_raptor"": 33.30880045890808, ""4_embed_raptor"": 0.15165352821350098, ""5a_hyde_pcs"": 0.5594143867492676, ""6a_search_pcs"": 0.025899648666381836, ""7a_rationale_pcs"": 184.74514269828796, ""5b_hyde_nps"": 0.6748034954071045, ""6b_search_nps"": 0.02574753761291504, ""7b_rationale_nps"": 434.5282139778137}",,
01C4E68B33CE2442806918E1002B2609,7,"Positive: [turns 118, 121] Agent handled the query and set up the payment system for billing | Agent provided proactive assistance and reduced customer effort during the call.” Agent reassured the customer with patience and ownership of the resolution.” 
· | Positive: [turn 136] - agent added the peacock also took payment customer in the end thank the agent nothing much observed on call as positive or negative.",7,"Passive: [turn 23] Caller want peacock channel back on TV Peacock added successfully. Card details set up on account. Customer engaged in routine inquiry without expressing strong satisfaction or dissatisfaction.” | Passive: [turn 3] Cx calling to add Peacock to their Tv package, Agent added the Peacock, Agent informed the charges to add Peacock, Added the payment card and setup the auto-pay. It was transactional call from both the sides.",7,Positive,"The agent successfully completed the customer's request to add Peacock, confirmed plan/price and billing dates, and completed the transaction despite multiple failed card attempts, showing persistence and clarity (account check, plan selection, and final confirmation). The agent read terms and billing clearly and confirmed the payment schedule when asked, reducing customer confusion about when charges would occur. There was some hesitancy and filler language, but the agent remained professional, patient, and ownership-focused while troubleshooting payment methods. Overall the interaction resolved the customer's need with moderate extra effort and clear communication, warranting an above-standard score but not exceptional. ('Passage 3','Passage 4','Passage 2','Passage 5','Passage 1')",8,Passive,"The caller ended the call having their request fulfilled and expressed thanks, but showed no strong enthusiasm — a mild positive outcome. Evidence that the agent agreed to add the service quickly is shown by the agent saying ('let's get you that right away.') (line 27). The caller chose the lower‑cost option and accepted ads, indicating practical satisfaction ('The the cheapest One.' (line 33) and 'I don't mind that.' (line 37)). The caller had a moment of concern about immediate billing ('do I have to make a payment today?' (line 49)), but the agent confirmed the charge and the transaction ultimately succeeded ('That One did go through. Thank you for that.' (line 125)). The agent also confirmed the issue was resolved ('well, we did get that, uh, taken care of for you.' (line 134)) and the caller closed politely ('Alright, well, thank you.' (line 136)). Taken together, this indicates a mildly positive, but not enthusiastic, post‑call view of Spectrum — fitting a Passive score of 8.  

Citations: ('let's get you that right away.') (27), ('The the cheapest One.') (33), ('I don't mind that.') (37), ('do I have to make a payment today?') (49), ('That One did go through. Thank you for that.') (125), ('well, we did get that, uh, taken care of for you.') (134), ('Alright, well, thank you.') (136).",calibrated,calibrated,7,7,False,1699,3.75,2269,0,0,0,5153,5192,12614,"{""1_preprocess"": 92.01480627059937, ""2_embed_chunks"": 4.263944149017334, ""3_raptor"": 33.30880045890808, ""4_embed_raptor"": 0.15165352821350098, ""5a_hyde_pcs"": 0.5594143867492676, ""6a_search_pcs"": 0.025899648666381836, ""7a_rationale_pcs"": 184.74514269828796, ""5b_hyde_nps"": 0.6748034954071045, ""6b_search_nps"": 0.02574753761291504, ""7b_rationale_nps"": 434.5282139778137}",,
01CA2971A26D9A4FAFF63FB639335A98,8,"Positive: [turns 19, 25] Agent clearly explained the customer about the past due and breakup of the bill | Positive: [turns 11,102] - agent shows sympathy about customer health, Positive: [turns 72, 84] - agent was polite and explain payment plan is already applied inform about the balance and said transferring to get the cable removed. - overall agent was polite and shows sympathy towards customer health which made customer feel better at the end of call. [seq 100] | Positive: [turn 11] Agent empathizes with the customer. Turn 25 45- Agent informed the left balance on the account. gent educated the customer how they can see the payment plan details on App and also informed that payment plan is already setup. Agent transfers the call to Customer Solutions to get Tv services removed. Agent was helpful throughout the call and investigated the account and clarified customer's confusion related to bills",5,"Detractor: [turns 7, 67] Customer is really dissatisfied as he is unable to see the payment plan on his bill that he is being put into | Detractor: [turns 7, 62] - customer seems not happy as was promised payment plan but app still showing full bill, Detractor: [turns 30, 52] - also asked to removed cable and said I don't think it was taken off, Promoter: [turn 100] - in the end after agent explanation customer said I feel little better.",7,Positive,"The agent reviewed the account, located the payment plan details and monthly amount ($3030.74) and explained how the customer can view statements in the app ('""your payment plan is included""', turns 71-73). The agent proactively offered to assist with payment and clearly identified that the TV removal was outside their scope and transferred the customer with context to customer solutions ('""I'm gonna get you transferred over to...customer solutions""', turns 55-56 and 90-96). The agent showed empathy and concern for the customer's recent hospitalization, which reduced customer effort and de-escalated stress ('""I'm so sorry to hear that""' and turns 99-106). Overall the issue was not fully resolved in this call but the agent handled it competently, empathetically, and routed it appropriately.  ",8,Passive,"The caller began with a billing problem: ('I was gonna be put on a on a payment plan.' - Caller, line 5) and ('I don't show the payment plan being reflected on the, on the bill.' - Caller, line 7). The agent clearly explained the payment plan and amount ('so you're paying $3030.74 a month.' - Agent, line 72) and what the past-due balance was ('when you see the past due of the two 5589 that's all you need to pay is the 25589.' - Agent, line 75), which resolved the caller's confusion. The agent also arranged a next step to fix the TV removal by transferring to solutions ('TV I'm gonna go ahead and get you over to umm. Our customer solutions department.' - Agent, line 55) and asked the caller to tell them it ('And just let them know it hadn't been removed' - Agent, line 95). The caller expressed gratitude and relief ('yes it does. Thank you so much.' - Caller, line 98) and noted feeling a bit better health-wise ('The medication is making me feel a little bit better.' - Caller, line 100). Overall the interaction was helpful and empathetic but not enthusiastic; the caller is likely somewhat satisfied but not a strong promoter, so a mild positive score (8) is appropriate.  

(cited evidence in quotes above corresponds to transcript lines.) (Every claim grounded in cited transcript excerpts.)  

Citations: ['I was gonna be put on a on a payment plan.', 'I don't show the payment plan being reflected on the, on the bill.', 'so you're paying $3030.74 a month.', 'when you see the past due of the two 5589 that's all you need to pay is the 25589.', 'TV I'm gonna go ahead and get you over to umm. Our customer solutions department.', 'And just let them know it hadn't been removed', 'yes it does. Thank you so much.', 'The medication is making me feel a little bit better.']  

Note: Numeric citation list provided separately below for clarity in automated checks.",calibrated,calibrated,8,8,False,2401,3.75,2892,0,0,0,6113,6435,15440,"{""1_preprocess"": 92.01480627059937, ""2_embed_chunks"": 4.263944149017334, ""3_raptor"": 33.30880045890808, ""4_embed_raptor"": 0.15165352821350098, ""5a_hyde_pcs"": 0.5594143867492676, ""6a_search_pcs"": 0.025899648666381836, ""7a_rationale_pcs"": 184.74514269828796, ""5b_hyde_nps"": 0.6748034954071045, ""6b_search_nps"": 0.02574753761291504, ""7b_rationale_nps"": 434.5282139778137}",,
01D040147C7CC840B4F31AE6AE673A12,7,"Positive: [turns 17, 42] Agent helped customer in processing payment | Call was handled adequately. Agent processed the payment smoothly. | Positive: [turn 4] - agent summarized the reason of call and took payment overall trasnsactional conversation related to payment. | Positive: [turn 17] Agent informed that they had past due amount of $49.35 Turn 42- Agent added the card and processed the payment. Agent get the customer's issue resolved for the customer.",7,"Passive: [turn 3] Customer called in to make payment | Caller needs were met. Payment processed and services would resume. | Customer call to make payment overall transactional cpnversation no negative or positive sentiment observed. | Passive: [turn 3] Customer calling to pay their Spectrum bill.
 cx had past due balance and agent added the card and processed the payment. It was neutral conversation hence scored Passive",7,Positive,"The agent efficiently completed the customer's request to pay a past-due balance and confirmed the outcome ('I processed that payment and it did go through successfully.'). The agent asked necessary verification questions, obtained payment details, and secured permission to charge and save the card ('do you give me permission to charge that card $49.35?' and 'Would you like for me to save this to your account for future payments?'). The agent provided a confirmation code and a clear timeline for service restoration ('it'll come back on in the next 5 to 60 minutes'), demonstrating competent, professional handling with minimal customer effort. Small repetition/clarity issues did not affect resolution, so the interaction is above routine but not exceptional.   ('We took care of that past due amount. It's currently processing.')  ('Right. So it'll come back on in the next 5 to 60 minutes.')  ('Would you like the confirmation code?')  ('do you give me permission to charge that card $49.35?')  ('I processed that payment and it did go through successfully.')  ('We took care of that past due amount. It's currently processing.')  ('May I please get your first and last name?')  ('And then just to recap with you today, Sir, you called in to make a payment.')  ('And is that your name, Sir? That's on that card?')  

(Quotes above are drawn from the transcript to support the assessment.)",8,Passive,"The call was a straightforward, successful payment interaction: the caller stated the reason for calling ('Umm hello, I was trying to pay my Spectrum bill.' (3)) and the agent resolved it ('I processed that payment and it did go through successfully.' (42)). The caller confirmed the payment and had no further complaints ('Yes.' (53); 'Yeah.' (57)). The agent was polite and helpful throughout ('Thank you for calling Spectrum. I hope you're having a fantastic day.' (1)) and provided useful information about service restoration timing ('Right. So it'll come back on in the next 5 to 60 minutes.' (60)). Overall the caller left satisfied but not enthusiastic—issue was resolved efficiently, so this aligns with a Passive score (7-8) rather than a Promoter or Detractor. ('Umm hello, I was trying to pay my Spectrum bill.' (3)) ('I processed that payment and it did go through successfully.' (42)) ('Yes.' (53)) ('Yeah.' (57)) ('Thank you for calling Spectrum. I hope you're having a fantastic day.' (1)) ('Right. So it'll come back on in the next 5 to 60 minutes.' (60)) .""  ,
  ""citations"": [1, 3, 42, 53, 57, 60]
}",calibrated,calibrated,9,9,False,908,3.75,1633,0,0,0,3507,3342,8482,"{""1_preprocess"": 92.01480627059937, ""2_embed_chunks"": 4.263944149017334, ""3_raptor"": 33.30880045890808, ""4_embed_raptor"": 0.15165352821350098, ""5a_hyde_pcs"": 0.5594143867492676, ""6a_search_pcs"": 0.025899648666381836, ""7a_rationale_pcs"": 184.74514269828796, ""5b_hyde_nps"": 0.6748034954071045, ""6b_search_nps"": 0.02574753761291504, ""7b_rationale_nps"": 434.5282139778137}",,
0204C70D18DFC4449E9B26C4D9C34F1D,8,"Positive: [turns 44, 51] Agent clearly guided the customer as when and how to make the payment making the customer feel safe and comfortable | agent demonstrated empathy, reassured the customer regarding the suspicious call, provided guidance on replacing the compromised card, explained autopay options, assisted with package changes, and attempted to help with the Dodgers channel request. The interaction was generally positive and customer-focused. | Positive: [turns 7, 28] - agent summarize the issue also shows concern about suspicious call, agent was polite overall. | Agent informed they can make the payment in Store and also set auto pay once they get their new card, Agent informed that they will have to pay $10 for Dodgers channel, Agent added the Dodgers channel, Agent shared all the relevant information with the cx and helped them making the changes to their TV package",7,"The customer was concerned about a potential scam call and the resulting payment issue, but she remained friendly and appreciative throughout the interaction. The agent addressed her concerns, provided guidance regarding payment and autopay, assisted with service changes, and the customer repeatedly expressed gratitude. | Customer call to report he has not made payment because he got a suspicious call and said he will make payment at store Promoter: [turn 60] - also thank the agent, overall transactional conversation no negative or positive sentiment observed. | Customer was calling about suspicious call and wanted to check if her bill was paid. Agent checked the details and informed that she can pay the bill at the end of the week. Customer also asked to remove the TV Silver package and add Dodgers. Agent made the changes. Customer didn't seem upset with Spectrum and her issue was resolved. There were no identifiable promoter or detractor transcript.",6,Neutral,"The agent acknowledged the customer's fraud concern and expressed empathy ('That is so weird. That is very concerning') while confirming details about the suspicious call ('he gave me his name as Jason Brown') which helped reassure the caller. The agent provided clear next steps for payment and autopay options ('When you get a new One, you can make it auto pay, you can do it in Store or you can do it over the phone') and explained charges and the add-on for the Dodgers ('it is an add on and it's a $10.00 add on'). The interaction was professional and competent, but not exceptional—the agent was still 'almost done putting it through' when the call ended, so the resolution appears partly completed rather than fully confirmed. ('I'm almost done putting it through to make sure you can get the Dodgers')""",8,Passive,"The caller expresses concern about a scam and its consequences—she says she ""had a funny phone call from spectrum"" ('You know, a few Days ago.' / 'I had a funny phone call from spectrum.' [2]) and describes the suspicious interaction: ""he said the Spectrum was sending someone with new Black boxes...and he had all the information on me"" ('he said the Spectrum was sending someone with new Black boxes...and he had all the information on me.' [8,27]). She took protective action (stop payment) but is cooperative and willing to resolve the issue by paying in person: ""Tomorrow, Saturday, I'll come down and pay the Bill."" ('Tomorrow, Saturday, I'll come down and pay the Bill.' [11,40-42]). The caller shows appreciation for the agent's help: ""Thank you. This is Nancy and I thank you for your kind service."" ('Thank you. This is Nancy and I thank you for your kind service.' [60]) and later: ""So now it's a little more reasonable and thank you for your help."" ('So now it's a little more reasonable and thank you for your help.' [72]). The agent also confirms acceptable timelines for payment ('Yeah, this weekend and beginning of next week is going to be just Fine to get the payment in.' [55]) and resolves service changes (removing Silver and adding Dodgers) ('Yes...the silver is $25.00, We'll take that off...to get the Dodgers...it's a $10.00 add on' [65]). Overall she is not enthusiastic enough to be a promoter but is satisfied and likely to remain a mild supporter after the call, so this maps to a Passive (8). Every claim above is grounded in the quoted transcript passages cited above ('I had a funny phone call from spectrum.' [2]; 'he said the Spectrum was sending someone with new Black boxes...and he had all the information on me.' [8,27]; 'Tomorrow, Saturday, I'll come down and pay the Bill.' [11,40-42]; 'Thank you. This is Nancy and I thank you for your kind service.' [60]; 'So now it's a little more reasonable and thank you for your help.' [72]; 'Yeah, this weekend and beginning of next week is going to be just Fine to get the payment in.' [55]; 'the silver is $25.00, We'll take that off...to get the Dodgers...it's a $10.00 add on' [65]).</rationale>,",calibrated,calibrated,7,7,False,1562,3.75,2004,0,0,0,4539,4856,11399,"{""1_preprocess"": 92.01480627059937, ""2_embed_chunks"": 4.263944149017334, ""3_raptor"": 33.30880045890808, ""4_embed_raptor"": 0.15165352821350098, ""5a_hyde_pcs"": 0.5594143867492676, ""6a_search_pcs"": 0.025899648666381836, ""7a_rationale_pcs"": 184.74514269828796, ""5b_hyde_nps"": 0.6748034954071045, ""6b_search_nps"": 0.02574753761291504, ""7b_rationale_nps"": 434.5282139778137}",,
