AgentRecordingSessionID,pcs_consensus_score,pcs_consensus_rationale,nps_consensus_score,nps_consensus_rationale,pcs_score,pcs_class,pcs_rationale,nps_score,nps_class,nps_rationale,hyde_mode_pcs,hyde_mode_nps,n_chunks,n_tree_nodes,is_long,token_count,processing_time_s,stage1_llm_tokens,stage3_llm_tokens,stage5_pcs_llm_tokens,stage5_nps_llm_tokens,stage7_pcs_llm_tokens,stage7_nps_llm_tokens,total_llm_tokens,stage_times,pcs_error,nps_error
03ED6D06682A994B82E2C8F37A34F4E5,8,"Positive: [turn 41] Agent followed the process and accordingly was able to set appointment with store | Agent provided clear resolution. Above standard efficient call handling. He reassured the caller about arriving early Positive: [turns 41, 43]. | Positive: [turns 14] Agent did proper questioning about what exactly customer required - Positive: [turns 42, 43] Also When customer confirmed about early appointment agent assured by saying yes. | Agent quickly resolved the issue and customer very happy",8,"Passive: [turns 11, 13] Customer needed an appointment with store as wants to set up new acccount | Caller request was straightforward to return equip at store and cancel phone line. Promoter: [turns 44, 46] Caller expressed happiness. | Customer wants to book the store appointment and cx seems happy at last. | Customer was calling to set up appointment. Agent took the details and set up the appointment. There is no identifiable promoter, or detractor turns so marking this call as passive.",6,Neutral,Agent efficiently booked the store appointment and confirmed the time: 'All right that reservation is set up for tomorrow 10:45 AM.' This resolved the customer's request with clear confirmations about arriving early: 'Yep that's correct.' The agent was professional and closed politely but the interaction was routine without extra empathy or proactive assistance beyond scheduling ('My pleasure anything else that i can Assist you with today.').,9,Promoter,"The caller expresses clear satisfaction with the resolution: the appointment was successfully scheduled ('All right that reservation is set up for tomorrow 10:45 AM.' (41)) and the caller confirms timing works ('OK that's Perfect.' (25)). At the end of the call the caller states explicit positive sentiment toward the interaction: 'Nope I'm very happy thank you' (46). The conversation is calm, helpful, and the caller had no further requests ('My pleasure anything else that i can Assist you with today.' / 'Nope I'm very happy thank you' (45-46)), indicating strong satisfaction that would likely reflect positively on Spectrum to others. Therefore this is scored as a 9 (strong positive sentiment), not a 10 because while satisfied, the caller did not provide emphatic enthusiasm or an explicit recommendation beyond being 'very happy.' ('Nope I'm very happy thank you' (46)).",calibrated,calibrated,10,10,False,481,3.75,0,0,0,0,2503,2557,5060,"{""1_preprocess"": 92.01480627059937, ""2_embed_chunks"": 4.263944149017334, ""3_raptor"": 33.30880045890808, ""4_embed_raptor"": 0.15165352821350098, ""5a_hyde_pcs"": 0.5594143867492676, ""6a_search_pcs"": 0.025899648666381836, ""7a_rationale_pcs"": 184.74514269828796, ""5b_hyde_nps"": 0.6748034954071045, ""6b_search_nps"": 0.02574753761291504, ""7b_rationale_nps"": 434.5282139778137}",,
040EE14BC4AF4447A4BEC56D184672CA,7,"Agent confirmed the due date of payment to avoid service interruption. | Agent took ownership and educated about due date | Agent showed his willingness to help with the customer situation, information provided on the restriction dates, got customer agreement for payment by then",7,"Called to confirm about payment arrangements. Agent informed the same. | Customer call to know about due date, no negative or positive sentiment obeserved | customer calling to make payment arrangements and wants to know the last date they could pay their bill to avoid service interruption- Passive transcript",6,Neutral,"Agent efficiently authenticated the caller via text and confirmed account details ('Could I text you a verification code?' / 'That will work.' (35-43)), clarified the exact amount and payment deadline ('pay that by Tuesday to avoid an interruption Wednesday the 27th' (44)), and the customer accepted the plan ('OK, alright, I make it happen.' (49)). Interaction was professional and clear, but largely routine with no additional offers to reduce effort or provide alternatives, so outcome was correct but not exceptional. Closing was polite and concise ('Hope you have a great day as well.' (51)).",8,Passive,"The caller contacted Spectrum to arrange payment ('I was calling UMM about making a getting a payment arrangement so to see when the latest The Last day I could pay my Bill for the cut it off.' (2)) and said they struggle with the app, preferring phone help ('I have it, but I ain't too good with that computer. You like just calling? ... interrupt the service.' (16)). The agent clearly communicated the due date to avoid interruption ('Got the 19433 cents? It does show you want to pay that by Tuesday to avoid an interruption Wednesday the 27th.' (44)) and the caller accepted the timeline and committed to pay ('OK, alright, I make it happen.' (49); 'Alright, thank you.' (50)). The call ends amicably with a recap and friendly closing from the agent ('Hope you have a great day as well.' (51)). Overall the customer’s issue was resolved and their tone is appreciative but not enthusiastic, indicating mild positive sentiment consistent with a Passive score (8).",calibrated,calibrated,10,10,False,637,3.75,0,0,0,0,2679,2866,5545,"{""1_preprocess"": 92.01480627059937, ""2_embed_chunks"": 4.263944149017334, ""3_raptor"": 33.30880045890808, ""4_embed_raptor"": 0.15165352821350098, ""5a_hyde_pcs"": 0.5594143867492676, ""6a_search_pcs"": 0.025899648666381836, ""7a_rationale_pcs"": 184.74514269828796, ""5b_hyde_nps"": 0.6748034954071045, ""6b_search_nps"": 0.02574753761291504, ""7b_rationale_nps"": 434.5282139778137}",,
041BFBFC9342244FB8110DAB4DCD6C69,7,Agent was helpful and also send the email so that customer is familiar with app before returning the boxes | Agent checked the current and past bills and explained the different charges and promotions on the account. Agent offered to remove the receivers on the account to reduce bill.,6,Customer received different bill also her experience at store was not good with spectrum | Cx had received the high bill and they are curious to understand their bill seems unhappy with their high bill. | Customer was calling about unexpected bill. Customer was informed about an amount while customer received bill which was more than double of the mentioned amount.,7,Positive,"The agent clearly explained why the charge was prorated and what billing period it covered, resolving the customer's confusion about the amount ('so you activated on the 30th so through the end of the Bill cycle which was the 19th' and 'this Bill is from May 20th through June 19th') and verified the monthly amount and discount changes. The agent identified the expired promotion and new discount, showed ownership by calculating adjusted totals, and offered practical ways to reduce charges (returning a box, switching to a $5 zumo box) and emailed setup instructions to reduce customer effort. The agent was polite, patient, and confirmed all questions were answered before closing, which left the customer satisfied. These actions demonstrate above-standard handling: accurate information, alternatives offered, empathy and clear next steps, though the interaction was routine rather than exceptional.",8,Passive,"The caller began concerned about a bill (""'cause i had been in Florida and i called on april 15th to have my service resumed"" (12); ""And now i get a Bill for $298.00 and I'm just curious."" (14)) but the agent clearly explained the prorated charge (""you activated on the 30th so through the end of the Bill cycle...you were prorated in amount of 102 59"" (23, 27)) and clarified the recurring monthly amount and discounts (promotion expiration and replacement discount: ""you had a discount of $35.00 and that expired"" / ""we add it automatically a $20.00 discount"" (40, 46)). The agent also identified ways to reduce future charges (switching to a $5 Zumo box saving about $40–$50 a month: ""that would save me 50 Bucks a month."" / agent: ""the zumos are only $5.00 versus that box fee."" (160, 153)). The call ends with the caller confirming resolution and thanking the agent (""Right OK OK thank you so much."" / ""Yes you have."" (199, 201)). Overall the caller left informed and appreciative but not enthusiastic—likely to remain satisfied yet unenthusiastic, so a mild positive / Passive score of 8 is appropriate. (Evidence cited above.)",calibrated,calibrated,9,9,False,3168,3.75,3676,0,0,0,6775,6685,17136,"{""1_preprocess"": 92.01480627059937, ""2_embed_chunks"": 4.263944149017334, ""3_raptor"": 33.30880045890808, ""4_embed_raptor"": 0.15165352821350098, ""5a_hyde_pcs"": 0.5594143867492676, ""6a_search_pcs"": 0.025899648666381836, ""7a_rationale_pcs"": 184.74514269828796, ""5b_hyde_nps"": 0.6748034954071045, ""6b_search_nps"": 0.02574753761291504, ""7b_rationale_nps"": 434.5282139778137}",,
041DECCAB320EE4D9A2AABAE682348A2,5,"call was completely transactional so selecting neutral | Agent proactively given option to cancel service. | Customer was calling to update credit card on the account. Positive: [turn 30] Agent updated the card. Customer further asked about reducing prices. Agent suggested to upgrade speed. Negative: [turn 52] Agent further offered to disconnect service and then subscribe again after 30 days. | Agent resolved the initial issue of updating the card details and informed the next payment date, later customer asked about the cheaper plan and agent offered one which was available. When customer said that he might look for cancelling to which agent said its as option which is no a right thing to say, however eventually agent was able to upgrade the internet, so overall an average call",5,"Customer said if no promotion i will cancel and said i will check for other options. | Customer was calling to update credit card on the account. Agent updated the credit card on the account. Detractor: [turns 35] Customer further asked about available promotions as he was getting options for other providers. Agent offered to mobile service and different internet speed. Detractor: [turns 69] Although customer agreed for speed change, he didn't seem interested in offers. | Customer not happy that he is unable to get the cheaper plan being an existing customer and mentioned of leaving Spectrum",7,Positive,"The agent efficiently completed the primary task by updating the customer's card and confirming autopay ('All right we got the visa 7482 set up for the auto pay') and communicated next steps ('looks like your next payment on the 25th of June') with clear closure. The agent listened to the customer's pricing concern and explored options, explaining limits and offering an immediate upgrade without forcing cancellation ('We could upgrade you to the 500...85 a month') while also stating the promotional constraint honestly ('these are the best options i can see right now'). Communication was polite and helpful throughout, and the agent completed the requested upgrade when the customer agreed ('Sounds good let's go ahead and do that upgrade...'). Overall this shows above-standard handling within the agent's scope, though they could have probed further for tailored promotions or escalated for better pricing options.  ('Yeah it's understandable it's always good to save money') ('All right so i'll get that into Effect')  ('Yeah these are the best options i can see right now')  ('Already').",3,Detractor,"The caller expressed clear dissatisfaction with pricing, saying the current bill is high ('So the the plans that i see on the spectrum website right now so I'm paying 90 Bucks.' ) (lines 45, 63) and asking for better options ('With that information is there any options available for me to update to better service with a much lower Price.' ) (line 51). The agent could not apply a better promotion to the existing account ('OK and there's nothing not any other promotions that you can apply to my account.' ; 'Yeah these are the best options i can see right now.' ) (lines 67-68), leading the caller to state cancellation as an option ('OK so the best option for me is to go ahead and cancel the service.' ) (line 69). Although the caller ultimately accepted an $85 upgrade ('Sounds good let's go ahead and do that upgrade for now the $85.00 One for 500 megabytes.' ) (line 72), they still compared Spectrum unfavorably to a competitor offering much lower price ('Hawaii Telecom offers the same service 600 megabytes for $40.00.' ) (line 78). Overall this indicates a moderately negative, likely post-call perception of Spectrum that could deter others, so I rate the caller a Detractor at 3 based on the evidence above ('I'm paying 90 Bucks.' ; 'OK so the best option for me is to go ahead and cancel the service.' ; 'Sounds good let's go ahead and do that upgrade...' ; 'Hawaii Telecom offers...$40.00.')."" ,  ""citations"": [45, 63, 51, 67, 68, 69, 72, 78]",calibrated,calibrated,9,9,False,1444,3.75,1954,0,0,0,4253,4279,10486,"{""1_preprocess"": 92.01480627059937, ""2_embed_chunks"": 4.263944149017334, ""3_raptor"": 33.30880045890808, ""4_embed_raptor"": 0.15165352821350098, ""5a_hyde_pcs"": 0.5594143867492676, ""6a_search_pcs"": 0.025899648666381836, ""7a_rationale_pcs"": 184.74514269828796, ""5b_hyde_nps"": 0.6748034954071045, ""6b_search_nps"": 0.02574753761291504, ""7b_rationale_nps"": 434.5282139778137}",,
041DF850D39CE244A9F1CB5407610979,7,"When customer said lines suspended due to fraud agent immediately said oh no which shows he is also concerned about customer issue and transfer the call to fraud department however there is not much to observed. | Positive: [turns 11, 26] Empathize and ownership shown by agent",4,Customer call as there is a fraud happened on her account authorized user added and set up internet without her authorization wants to speak to fraud department agent transfer call to fraud department. overall customer is looking sad due to fraud | Detractor: [turn 12] Cx was confused about their bill Detractor: [turns  15 18] Someone was added on cx's account with their knowledge and opened internet services on their account and they turn off the customer's phone. customer had fraud on their account. Customer was not happy with this situation,7,Positive,"The agent successfully reactivated the customer's lines and initiated a handoff to fraud, reducing immediate customer impact ('So we reactivating the Lines right now' (26) and 'I can get you over there to the fraud department.' (28-29)). The agent demonstrated ownership by checking notes and verifying details with the fraud team before transferring ('I'm checking right now to see if there is any fraud added to the account' (64) and authentication steps with the fraud rep (36-44)). The interaction included minor confusion and a brief incorrect statement that the customer suspended the lines, which the agent apologized for, but overall the agent communicated professionally and routed the customer to the correct team for the unresolved fraud/linking issues ('I apologize... You're the One who suspended the Lines.' (11-13) and apology/clarification (58)). These actions fit above-standard handling given scope limitations, though not exceptional due to the earlier confusion and some back-and-forth on notes and context (51-56, 57-63).",8,Passive,"The caller expresses frustration about unauthorized activity on her account — ""someone was doing fraud on my account"" ('Well, I didn't suspend. I didn't suspend the Lines. Actually. Someone was doing fraud on my account.'; line 15) and needs escalation, which is a negative signal. At the same time the agent quickly reactivated service and offered transfer to fraud: ""So we reactivating the Lines right now"" ('OK, great. All right then. Great. All right, So we reactivating the Lines right now, ma'am and.'; line 26) and ""I can get you over there to the fraud department"" ('All right. And I can get you over there to the fraud department.'; line 28), and the caller responds appreciatively ('OK. Thank you.'; line 29). The interaction resolves the immediate service outage and plans next steps (agent will refer to fraud/mobile teams), so the overall result is more satisfied than angry but not enthusiastic. Given the mix of a service problem caused by fraud and a competent, helpful agent response, the caller is likely to remain satisfied but unenthusiastic toward Spectrum after the call ('But but yeah, there isn't any new mobile, no new mobile at all. She's I'm going to have to send her right back over to mobile.'; line 97). This aligns with a Passive score (8). Each claim grounded in the transcript: fraud issue (line 15), reactivation offered (line 26), transfer to fraud offered (line 28), caller acceptance/thank you (line 29), and plan to escalate mobile linking (line 97).  

Citations: ('Well, I didn't suspend. I didn't suspend the Lines. Actually. Someone was doing fraud on my account.'; line 15), ('OK, great. All right then. Great. All right, So we reactivating the Lines right now, ma'am and.'; line 26), ('All right. And I can get you over there to the fraud department.'; line 28), ('OK. Thank you.'; line 29), ('But but yeah, there isn't any new mobile, no new mobile at all. She's I'm going to have to send her right back over to mobile.'; line 97).  

Note: Citations correspond to cited transcript lines above and are listed in the citations field below for clarity.




































































































































































































































































































































































































































































































































































































































































































































































































































































































































































































































































































































































































































































































































































































































































































































































































































































































































































































































































































































































































































































































































































































































































































































































































































































































































































































































































































































































































































































































































































































































































































































































































































































	a



























































































































































































































































































































































































































































































































































































































































































































































































































































































































































































































































































































































































































































































































































































































































































































































































































































































































































































































































































",calibrated,calibrated,6,6,False,1924,3.75,3173,0,0,0,5382,10670,19225,"{""1_preprocess"": 92.01480627059937, ""2_embed_chunks"": 4.263944149017334, ""3_raptor"": 33.30880045890808, ""4_embed_raptor"": 0.15165352821350098, ""5a_hyde_pcs"": 0.5594143867492676, ""6a_search_pcs"": 0.025899648666381836, ""7a_rationale_pcs"": 184.74514269828796, ""5b_hyde_nps"": 0.6748034954071045, ""6b_search_nps"": 0.02574753761291504, ""7b_rationale_nps"": 434.5282139778137}",,
