,AgentRecordingSessionID,pcs_consensus_score,pcs_consensus_rationale,nps_consensus_score,nps_consensus_rationale,pcs_score,pcs_class,pcs_rationale,nps_score,nps_class,nps_rationale,hyde_mode_pcs,hyde_mode_nps,n_chunks,n_tree_nodes,is_long,token_count,processing_time_s,pcs_error,nps_error
0,0199B3D5A99E494F91D4755A4A3E4C1A,7,"Positive: [turns 111, 116] Agent properly guided the customer as regards making payment | Positive: [turn 109] Proactively asked if caller want to save card on file. Payment processed smoothly. Agent resolved customer concern efficiently. | Positive: [turn 6] - agent took ownership and take the payment. | Agent updated the email address on the account and updated the card details and processed the payment. Agent informed that it may take upto an hour to get the services back on. Agent helped the customer to make the payment and restore their services hence scored Positive",7,"Called to make payment. Payment done successfully. caller displayed neither enthusiasm nor dissatisfaction. | Customer call to make payment no negative or positive sentiment observed as overall transactional conversation. | Cx calling to make the payment, agent updated the card details and processed the payment. It was transactional conversation throughout the call hence scored Passive | Customer was calling to make a payment. Agent updated the account with the latest phone number and email address. Customer made the payment. There were no identifiable promoter or detractor transcripts on the call.",8,Positive,"Agent efficiently processed the payment and confirmed success ('That was successful.' [113]) while also saving the new card on file per the customer's request ('save the car.' [110]). The agent proactively updated the customer's contact details to make future calls smoother ('give me just a second to update it... make it easier on you the next time you call in.' [53-55]). They set expectations about service restoration time and ownership of the next steps ('I've done everything on my side... you should probably see your services within the next like 10-15 minutes.' [116]). Throughout the call the agent remained polite and clear, resulting in the customer's expressed satisfaction ('Yes, ma'am. Thank you.' [119]).",8,Passive,"The caller’s issue was resolved and they expressed simple satisfaction rather than enthusiasm. They called to pay their bill ('Oh, how are you? Umm, yeah, I, I just, I just want to pay my bill.' (4)) and the agent successfully processed the payment ('So we are going to utilize Visa ending in 1822 for the payment amount of 111.' (111); 'OK, That was successful.' (113)). The agent also set up account conveniences and explained restoration timing which likely left the caller content ('All right, all changes made...' (65); 'It can take up to an hour to restore services... you should probably see your services within the next like 10-15 minutes.' (116)). The caller closed politely and thanked the agent ('Yes, ma'am. Thank you.' (119)), indicating satisfaction but no enthusiastic endorsement of Spectrum, so a mild positive score of 8 is appropriate under the rubric. ('Thank you for calling Spectrum.' (1)) .

Cited lines support resolution, helpfulness, and polite satisfaction rather than strong advocacy or strong complaints, fitting a Passive classification with score 8.

citations: [4,111,113,65,116,119,1]

Note: The last line is included to show brand mention and courteous close supporting mild positive sentiment.",calibrated,calibrated,28,28,False,1339,3.32,,
1,01C15847BA7F464AB935A29290D6CED6,8,"Positive: [turns 9, 20] Agent handled the query efficiently and submitted the ticket letting know that customer does not possess the equipment | They explained the ticket process clearly, reassured the caller, and answered additional questions about email account duration The agent exceeded expectations by reducing customer effort and providing clarity | Customer was calling about missing equipment. Agent checked the details and informed that he submitted a ticket to investigate the missing equipment. Agent educated customer that their team will investigate and resolve the issue.",6,"Detractor: [turn 4] - Customer shows slight dissatisfaction as her husband went to store to return equipment and they ask said there are other additional equipment's as well on account, which according to customer they don't have.",7,Positive,"The agent identified the issue, verified the account address, and proactively submitted an equipment research ticket to clear the returned items, showing ownership of the problem ('It's an equipment Research ticket' (turn 11); 'I've got this ticket submitted' (turn 20)). The agent used a professional and polite tone, asked to place the caller on a brief hold while working the ticket, and returned promptly ('can i put you on a brief hold' (turn 15); 'thank you so much for holding' (turn 19)). The agent set clear expectations for resolution time and confirmation (about 48 hours and an email) and answered a follow-up question about TWC email deactivation ('60 Days' (turn 22)). Handling stayed within agent scope and resolved what they could, with good communication and low customer effort overall, though the resolution required backend processing rather than immediate finalization.",8,Passive,"The agent resolved the caller's problem by submitting an equipment research ticket ('All right i've got this ticket submitted' (20)) and provided a clear timeline for resolution ('that usually takes about 48 hours' (20)), which the caller thanked the agent for ('Thank you i really appreciate it' (21)). The agent also answered the caller's follow-up question about email account timing concisely ('60 Days' (22)), and the call ended with polite, satisfied closings ('You too thank you.' (27)). Overall the caller appears satisfied but not enthusiastic—service was completed and the customer expressed appreciation, so this aligns with a Passive score (8). Every claim above is grounded in the transcript ('All right i've got this ticket submitted' (20); 'Thank you i really appreciate it' (21); '60 Days' (22); 'You too thank you.' (27)).",calibrated,calibrated,5,5,False,690,3.32,,
2,01C4E68B33CE2442806918E1002B2609,7,"Positive: [turns 118, 121] Agent handled the query and set up the payment system for billing | Agent provided proactive assistance and reduced customer effort during the call.” Agent reassured the customer with patience and ownership of the resolution.” 
· | Positive: [turn 136] - agent added the peacock also took payment customer in the end thank the agent nothing much observed on call as positive or negative.",7,"Passive: [turn 23] Caller want peacock channel back on TV Peacock added successfully. Card details set up on account. Customer engaged in routine inquiry without expressing strong satisfaction or dissatisfaction.” | Passive: [turn 3] Cx calling to add Peacock to their Tv package, Agent added the Peacock, Agent informed the charges to add Peacock, Added the payment card and setup the auto-pay. It was transactional call from both the sides.",7,Positive,"The agent successfully completed the customer's purchase and confirmed the service was active ('That One did go through. Thank you for that.') while clearly explaining billing timing and charges ('You'll be charged 1099 plus taxes each month thereafter') which demonstrates outcome-focused handling. The agent was patient and persistent through multiple failed card attempts, asking for alternative payment details and retrying until successful ('OK, I'm gonna change the billing layer... 4432 got it changing to that.') showing ownership and follow-through. Communication included repetition of important terms (service, price, payment date) and checking customer understanding ('So let's get you that right away' and 'the 20th of next month'), though the interaction had some filler language and moments of minor confusion that kept it from being exceptional. Overall the agent handled scope and process well, minimized customer effort, and closed the call politely ('we did get that, uh, taken care of for you').",8,Passive,"The issue the caller called about (adding Peacock) was resolved: agent confirms the add with ""Peacock, come your way."" ('Peacock, come your way.' [31]) and later ""That One did go through. Thank you for that."" ('That One did go through. Thank you for that.' [125]). The caller expresses polite satisfaction and ends the call with thanks: ""Alright, well, thank you."" ('Alright, well, thank you.' [136]). The caller did express mild concern about billing and remembering payments (""My spaces took out automatically... I seem to forget about them"") which shows worry but not hostility toward Spectrum ('My spaces took out automatically. I seem to forget about them and use the money for other things.' [132]). Overall the call outcome is positive but not enthusiastic — problem solved and caller is satisfied but cautious about charges — fitting the Passive (7-8) band, so I assign an 8. (Also earlier confusion about the security code was handled without friction: ""Amairos told it to you. Wrong... 6497, there you go."" ('Amairos told it to you. Wrong. Uh, it's trial. 6497, there you go.' [15]). )",calibrated,calibrated,7,7,False,1699,3.32,,
3,01CA2971A26D9A4FAFF63FB639335A98,8,"Positive: [turns 19, 25] Agent clearly explained the customer about the past due and breakup of the bill | Positive: [turns 11,102] - agent shows sympathy about customer health, Positive: [turns 72, 84] - agent was polite and explain payment plan is already applied inform about the balance and said transferring to get the cable removed. - overall agent was polite and shows sympathy towards customer health which made customer feel better at the end of call. [seq 100] | Positive: [turn 11] Agent empathizes with the customer. Turn 25 45- Agent informed the left balance on the account. gent educated the customer how they can see the payment plan details on App and also informed that payment plan is already setup. Agent transfers the call to Customer Solutions to get Tv services removed. Agent was helpful throughout the call and investigated the account and clarified customer's confusion related to bills",5,"Detractor: [turns 7, 67] Customer is really dissatisfied as he is unable to see the payment plan on his bill that he is being put into | Detractor: [turns 7, 62] - customer seems not happy as was promised payment plan but app still showing full bill, Detractor: [turns 30, 52] - also asked to removed cable and said I don't think it was taken off, Promoter: [turn 100] - in the end after agent explanation customer said I feel little better.",7,Positive,"The agent accurately reviewed the account, confirmed the payment plan and showed the customer where to find the plan in the app ('your payment plan is included in your billing charges' / 'they broke it down into 12 months, so you're paying $3030.74 a month') and clearly explained the past-due amount ('when you see the past due of the two 5589 that's all you need to pay is the 25589'). The agent demonstrated empathy and rapport after the customer disclosed a recent hospitalization ('I'm so sorry to hear that' and 'I hope you start feeling better'), offered to assist with payment, and did not leave the customer without next steps ('I'm gonna get you transferred over to our customer solutions' to remove the TV service). Because the issue required a transfer out of the agent's scope but was handled with clear explanation, empathy, and an appropriate routing, this interaction is above routine but not exceptional, so a score of 7 is appropriate. All claims are grounded in the transcript excerpts cited below ('I can do that for you', 'they had to pull up', 'they actually put a $675 credit on there').",8,Passive,"The caller leaves the call informed and appreciative but not enthusiastically so, which fits a Passive. The agent clearly resolved the caller's confusion about the payment plan by explaining ""you're paying $3030.74 a month"" ('""you're paying $3030.74 a month.""' - line 72) and confirming what balance needed to be paid: ""when you see the past due of the two 5589 that's all you need to pay"" ('""when you see the past due of the two 5589 that's all you need to pay is the 25589.""' - line 75). The original problem (TV service not removed) was acknowledged and required a handoff: ""TV I'm gonna go ahead and get you over to ... Our customer solutions department"" ('""TV I'm gonna go ahead and get you over to umm. Our customer solutions department.""' - lines 55-56), so the issue was not fully resolved in this call. The agent was also empathetic and the caller expressed gratitude and relief (""Thank you so much"" / ""The medication is making me feel a little bit better"") ('""Thank you so much.""' - line 96; '""The medication is making me feel a little bit better.""' - line 100), indicating satisfaction with the interaction but not strong enthusiasm for the brand. Overall, the call would likely not drive referrals but would not harm Spectrum's reputation — consistent with an NPS of 8 (Passive). Each claim is grounded in the transcript quotes above and supporting lines cited below in the evidence field.""  ,  ",calibrated,calibrated,7,7,False,2401,3.32,,
4,01D040147C7CC840B4F31AE6AE673A12,7,"Positive: [turns 17, 42] Agent helped customer in processing payment | Call was handled adequately. Agent processed the payment smoothly. | Positive: [turn 4] - agent summarized the reason of call and took payment overall trasnsactional conversation related to payment. | Positive: [turn 17] Agent informed that they had past due amount of $49.35 Turn 42- Agent added the card and processed the payment. Agent get the customer's issue resolved for the customer.",7,"Passive: [turn 3] Customer called in to make payment | Caller needs were met. Payment processed and services would resume. | Customer call to make payment overall transactional cpnversation no negative or positive sentiment observed. | Passive: [turn 3] Customer calling to pay their Spectrum bill.
 cx had past due balance and agent added the card and processed the payment. It was neutral conversation hence scored Passive",6,Positive,"The agent efficiently resolved the customer's payment by processing the past due amount and confirming it ""did go through successfully"" ('I processed that payment and it did go through successfully.'). The agent collected necessary payment details, offered to save the card ('Would you like for me to save this to your account for future payments?') and obtained permission to charge the card ('do you give me permission to charge that card $49.35?'), demonstrating proper process adherence. The agent provided a confirmation code and clear follow-up information about service restoration timing ('So it'll come back on in the next 5 to 60 minutes.'), but the interaction was routine rather than notably proactive or highly empathetic. Overall this is solid, correct handling with a resolved outcome and professional communication, meriting a standard positive score of 6.  ('I processed that payment and it did go through successfully.'; 'Would you like for me to save this to your account for future payments?'; 'So it'll come back on in the next 5 to 60 minutes.')",8,Passive,"The caller called to make a payment ('Umm hello, I was trying to pay my Spectrum bill.'), and the agent successfully processed the past-due payment ('I processed that payment and it did go through successfully.'), which resolves the caller's reason for calling. The caller affirms the resolution ('Yeah') and has no further complaints, asking only about service restoration time ('So what is our my cable gonna be on like right like now if that's y'all doing it.'), to which the agent gives a clear expectation ('Right. So it'll come back on in the next 5 to 60 minutes.'). The interaction is courteous and ends amicably ('You too.'), indicating mild positive sentiment but not strong enthusiasm or promotion. Overall, this would not strongly promote Spectrum but leaves the caller satisfied — matching the Passive (8) category per the rubric. ('Umm hello, I was trying to pay my Spectrum bill.')( 'I processed that payment and it did go through successfully.')( 'Yeah')( 'So what is our my cable gonna be on like right like now if that's y'all doing it.')( 'Right. So it'll come back on in the next 5 to 60 minutes.')( 'You too.')

Cited lines support resolution and neutral-to-mildly positive sentiment rather than clear promoter-level enthusiasm or detractor-level dissatisfaction.






















































































































































































































































































































































































































































































































































































































































































































































































































































",calibrated,calibrated,7,7,False,908,3.32,,
5,0204C70D18DFC4449E9B26C4D9C34F1D,8,"Positive: [turns 44, 51] Agent clearly guided the customer as when and how to make the payment making the customer feel safe and comfortable | agent demonstrated empathy, reassured the customer regarding the suspicious call, provided guidance on replacing the compromised card, explained autopay options, assisted with package changes, and attempted to help with the Dodgers channel request. The interaction was generally positive and customer-focused. | Positive: [turns 7, 28] - agent summarize the issue also shows concern about suspicious call, agent was polite overall. | Agent informed they can make the payment in Store and also set auto pay once they get their new card, Agent informed that they will have to pay $10 for Dodgers channel, Agent added the Dodgers channel, Agent shared all the relevant information with the cx and helped them making the changes to their TV package",7,"The customer was concerned about a potential scam call and the resulting payment issue, but she remained friendly and appreciative throughout the interaction. The agent addressed her concerns, provided guidance regarding payment and autopay, assisted with service changes, and the customer repeatedly expressed gratitude. | Customer call to report he has not made payment because he got a suspicious call and said he will make payment at store Promoter: [turn 60] - also thank the agent, overall transactional conversation no negative or positive sentiment observed. | Customer was calling about suspicious call and wanted to check if her bill was paid. Agent checked the details and informed that she can pay the bill at the end of the week. Customer also asked to remove the TV Silver package and add Dodgers. Agent made the changes. Customer didn't seem upset with Spectrum and her issue was resolved. There were no identifiable promoter or detractor transcript.",7,Positive,"The agent handled the call competently and with empathy: she acknowledged the suspicious call and confirmed the customer's concerns ('OK. So I understand we got a suspicious call...' (turn 7)) and slowed/clarified after the customer said the agent spoke fast ('Yeah, sorry about that...' (turn 18)). She verified and processed the requested changes—removing the $25 Silver package and adding the $10 Dodgers channel—and explained costs clearly ('We'll take that off... it's a $10.00 add on' (turns 65-66)). The agent gave practical guidance on resolving autopay after the customer replaces her card and confirmed acceptable payment timing ('When you get a new One, you can make it auto pay...' and 'this weekend and beginning of next week is going to be just Fine' (turns 51,55)). Overall this is above-standard, empathetic service with clear next steps, though not exceptionally proactive beyond routine account changes, so a 7 is appropriate.  ('I put a stop payment...' (turn 2); 'I'm almost done putting it through...' (turn 73))",8,Passive,"The caller expresses concern about a suspected scam and an unpaid bill: 'I had a funny phone call from spectrum. So i put a stop payment on my charge card.' ('I had a funny phone call from spectrum. So i put a stop payment on my charge card.') and 'when he called, he said the Spectrum was sending someone with new Black boxes...and he had all the information on me' ('when he called, he said the Spectrum was sending someone with new Black boxes because they're working in my area...and he had all the information on me'). They repeatedly describe the fraudulent caller having their card number: 'Because i refuse to give him the first 4 digits, he gave it to me instead.' ('Because i refuse to give him the first 4 digits, he gave it to me instead.'). Despite this negative experience, the agent resolves service requests and is helpful—caller thanks the agent: 'Thank you. This is Nancy and I thank you for your kind service.' ('Thank you. This is Nancy and I thank you for your kind service.')—and the agent confirms the requested changes and pricing ('We’ll take that off... to get the Dodgers... it's a $10.00 add on' and 'I'm almost done putting it through to make sure you can get the Dodgers.') ('Yes. So the silver is $25.00, We'll take that off...it is an add on and it's a $10.00 add on' ; 'I'm almost done putting it through to make sure you can get the Dodgers.'). The agent also confirms acceptable timing for the payment ('this weekend and beginning of next week is going to be just Fine to get the payment in.') ('this weekend and beginning of next week is going to be just Fine to get the payment in.'). Holistically, the call starts with a service-impacting negative (potential fraud, missed payment) but ends with effective, friendly support and resolution of requests; that yields mild positive sentiment but not strong enthusiasm—so the caller is best labeled Passive (8). If shared, the call would likely not promote Spectrum strongly but would not actively detract either.  

Cited evidence: 'I had a funny phone call from spectrum. So i put a stop payment on my charge card.'; 'when he called, he said the Spectrum was sending someone with new Black boxes because they're working in my area...and he had all the information on me'; 'Because i refuse to give him the first 4 digits, he gave it to me instead.'; 'Thank you. This is Nancy and I thank you for your kind service.'; 'Yes. So the silver is $25.00, We'll take that off...it is a $10.00 add on'; 'I'm almost done putting it through to make sure you can get the Dodgers.'; 'this weekend and beginning of next week is going to be just Fine to get the payment in.'  

(These quotes map to the transcript lines cited below.)  

Note: Caller concern about fraud is significant but the agent's helpfulness prevents a detractor outcome; thus score 8 (Passive).  

Citations: ('I had a funny phone call from spectrum. So i put a stop payment on my charge card.' - line 2), ('when he called, he said the Spectrum was sending someone with new Black boxes because they're working in my area...and he had all the information on me' - line 8), ('Because i refuse to give him the first 4 digits, he gave it to me instead.' - line 32), ('Thank you. This is Nancy and I thank you for your kind service.' - line 60), ('Yes. So the silver is $25.00, We'll take that off...it is an add on and it's a $10.00 add on' - line 65), ('I'm almost done putting it through to make sure you can get the Dodgers.' - line 73), ('this weekend and beginning of next week is going to be just Fine to get the payment in.' - line 55).  

Final evidence lines: [2, 8, 32, 60, 65, 73, 55].",calibrated,calibrated,9,9,False,1562,3.32,,
