,AgentRecordingSessionID,pcs_consensus_score,pcs_consensus_rationale,nps_consensus_score,nps_consensus_rationale,pcs_score,pcs_class,pcs_rationale,nps_score,nps_class,nps_rationale,hyde_mode_pcs,hyde_mode_nps,n_chunks,n_tree_nodes,is_long,token_count,processing_time_s,pcs_error,nps_error
92,9C56D0D37F93864F969936B41D91B260,7,"Positive: [turn 5, 63] - Agent shows empathy inform about the procedure of can activate the service first and then advise calling back tomorrow to cancel the service. Agent was polite throughout the call but not much can do apart from informing about the process. | Customer was calling to cancel service and was upset about account being put to seasonal hld. Agent informed that he can remove the seasonal hold and then customer can call the next day to cancel service. Agent followed the procedure and explained that to customer.",2,"Detractor: [turns 3, 53, 54] - customer was not happy as called to cancel but previous agent convinces to put the service on hold but never informed about this is chargeable, Detractor: [turns 64, 65, 72, 73, 74, 79] Also got frustrated about the process of activate the service and then was advised to call back tomorrow to cancel the service said i am very upset. also used abused language. | cx called previously to cancel their services, agent put the cx's account on hold, cx was not informed that they will get charged for keeping it on hold, cx wanted to cancel as the house is gone be for sale, turn 65,72,73- Cx expressed their dis-satisfaction and they were furious to know that they had to wait for 24 hours to get the account cancelled.",6,Neutral,"The agent correctly identified the account state and explained the required process, saying 'we can't make changes when it's paused' and offering a practical workaround: 'I could turn it back on today and then have you call tomorrow to turn it off' (57-69, 50-56). Verification steps were handled reasonably with alternative options when the caller's phone failed ('I could send an email or a phone call if that Works better') (25-41). The agent remained calm and informative despite the caller's strong frustration, but the solution required extra effort from the customer and the agent's wording was occasionally unclear, so the handling is competent but not exceptional ('I'm cereal' and some awkward phrasing) (57-69). Overall the agent followed process, showed ownership within scope, and provided the correct next steps, earning a solid standard score rather than positive or negative extremes (50-56, 57-69).",2,Detractor,"The caller is strongly negative about their experience and indicates they will publicize it. They complain the prior rep left them on hold and didn’t disclose charges: ('II. Actually wanted to cancel and the Guy was a hold me or have me on hold for i don't know how Long for closing One hour.' - line 53) and ('But now he never told me it's a churge.' - line 54). The agent’s solution (turn service back on then cancel later) frustrates the caller and is perceived as unacceptable: ('I could turn it back on today and then have you call tomorrow to turn it off.' - line 63) and ('¿Are you kidding?' - line 65). The caller uses profanity and calls the situation abusive, indicating strong anger and intent to complain publicly: ('Mucha madre ahí hijo de tu puta madre, ya me hartaron, ahora sí chinga la madre.' - line 70), ('¿You know what? I'm gonna post this. This is abuse.' - line 72), and ('This is abusive.' - line 76). Overall the interaction would likely damage Spectrum’s reputation if shared, so this call indicates a strong negative (detractor) sentiment toward Spectrum after the call ends.  

Cited evidence supports the assessment that the caller is very upset about undisclosed charges, unsatisfactory resolution, and plans to post about the experience, meeting the rubric criteria for a strong negative score (2).  

Citations: lines 53, 54, 63, 65, 70, 72, 76, 79.  

('II. Actually wanted to cancel and the Guy was a hold me or have me on hold for i don't know how Long for closing One hour.' - 53) ('But now he never told me it's a churge.' - 54) ('I could turn it back on today and then have you call tomorrow to turn it off.' - 63) ('¿Are you kidding?' - 65) ('Mucha madre ahí hijo de tu puta madre, ya me hartaron, ahora sí chinga la madre.' - 70) ('¿You know what? I'm gonna post this. This is abuse.' - 72) ('This is abusive.' - 76) ('Puta madre.' - 79).  

(Note: quoted excerpts above are taken directly from the transcript and linked to the cited line numbers.)

---

Citations array below lists the primary lines referenced above for clarity and traceability in the transcript provided above: [53, 54, 63, 65, 70, 72, 76, 79].













































































































































































































































































































































































































































































































































































































































































































































































































































































































































































































",calibrated,calibrated,8,8,False,1041,3.32,,
93,9FD734A0078946418EB9928017500A74,7,"Positive: [turn 9] Agent informed that they had past due on their account. Agent informed the breakdown of the bill, cx wanted to cancel their services, agent tried many times to explain the customer that they need to cancel their service with different but cx don't want to speak with anyone. Agent explained the bill and patiently educated the cx about cancellation. | Agent: Customer was calling about high bill. Agent explained the charges. Customer asked to cancel service. Agent informed that he would need to transfer call to different department to cancel service. Agent followed the procedure.",1,"Detractor: [turns 14, 15, 19] - Customer concern about bill went up, got angry and said i am looking to cancel as every time you gone up and never tell me i am not interested in your service, Detractor: [turns 28, 34, 37, 40, 44] - customer got angry when agent said for cancellation i need to transfer you said i don't want to talk to anybody i am not going to pay anymore after this payment you all are worthless | Customer was complaining about her high bill. Agent checked the details and informed him about the different charges in the bill. Customer weas very upset and asked to cancel the account. Agent informed that he would need to transfer call to different department. Customer was not ready to speak to anyone and asked to cancel service.",6,Neutral,"The agent correctly explained the balance breakdown and late fee ('So the reason why it is showing 25790...' / 'the breakdown of that 128 is...') and attempted to route the customer to the cancellations team multiple times. The agent upheld process limits by stating they could not cancel service themselves and repeatedly offered a transfer ('I'm not able to do that... I have to get you to a different department'). The agent was mostly professional and clear but did not successfully de-escalate the caller or offer alternatives (the caller remained upset and refused further contact). Given the correct information, proper routing, and lack of resolution, this interaction rates as solid routine handling but not above standard.",1,Detractor,"The caller expresses very strong negative sentiment and intent to abandon and punish the company: they demand cancellation and say ""Can you cancel my Internet? You can cancel my whole service"" ('Can you cancel my Internet? You can cancel my whole service.' - line 14) and explicitly refuse further payments: ""I'm not going to pay you anymore after this payment"" ('I'm not going to pay you anymore after this payment.' - line 19). They use hostile language about Spectrum: ""Y'all are worthless aren't you?"" ('Y'all are worthless aren't you?' - line 34) and ""You're crooks."" ('You're crooks.' - line 37). Finally they state a lasting refusal to pay: ""They'll never get another dollar from me at once. I pay this one"" ('They'll never get another dollar from me at once. I pay this one.' - line 44). These statements indicate very strong dissatisfaction and likelihood to actively detract from Spectrum, so the appropriate score is 1 (very strong negative). Every claim above is supported by the quoted lines from the transcript cited inline and listed below as evidence.  

Citations: ('Can you cancel my Internet? You can cancel my whole service.' - line 14), ('I'm not going to pay you anymore after this payment.' - line 19), ('Y'all are worthless aren't you?' - line 34), ('You're crooks.' - line 37), ('They'll never get another dollar from me at once. I pay this one.' - line 44).""  )  .",calibrated,calibrated,6,6,False,806,3.32,,
94,A4693C84ED480E4193C9450B65480D03,8,"Positive: [turn 26] Agent clearly explained the break-up of the bill and the rate increase that happened | Positive: [turns 26, 38] - agent inform about nationwide rate increase also explain the bill Positive: [turns 51, 84, 86] - shows empathy when customer was too irate, also relate the frustration with his own example, overall agent was polite shows empathy relate to the problem and transfer the call to supervisor [56] as dont have teh authorizatin to do it. | Agent explained the bill to the customer, Agent explained that there was a charge of $5 as they have paid with the agent, Turn 51, 84, 86- Agent empathize with the customer. Agent tried to explain the bill to the customer and transferred the call to supervisor. Agent was helpful throughout the conversation and investigated the account and explained all the charges in detail hence scored Positive | Customer was calling about the high bill and was very frustrated. Agent empathized with the customer and explained the billing. Agent listened to the customer patiently and offered to transfer call to lead to resolve the issue. Agent warm transferred the call to lead.",1,"Detractor: [turns 2, 4, 5, 27] - Customer got frustrated as bill went up said you all keep raising the bill i am gonna go top other provider Detractor: [turns 29, 40, 42, ] - says facing problem since i get you, spectrum is greedy also used abused language Detractor: [turns 46, 47, 55] - Says eve i was not aware they charge me for making payment representative never informed me. overall negative sentiment observed. | Customer was calling about the high bill. Agent explained the bill. Customer was very upset about the increase in bill. Customer was also very upset that he was charged $5 for payment over the call. Customer was very frustrated and kept using bad language throughout the call.",6,Neutral,"The agent clearly explained the billing details and the two fees that caused the increased balance ('When you make a payment ... they charge a $5.00 fee' / 'they charge a $2.00 fee for that') and verified credits that reduced prior bills ('they credited you ... brought it down to that 169'). The agent showed empathy and matched the customer's frustration ('Trust me ma'am i completely understand' and 'i understand your frustration'). The agent acknowledged their lack of authorization to remove the fees but took appropriate ownership by offering to escalate to a lead for fee review ('i don't have authorization to remove that ... i can get you to a lead'). Overall competent, routine handling with correct routing and empathy but no immediate resolution, so a solid neutral score.  ('47-56','35-46','57-73','100-111')",1,Detractor,"The caller expresses very strong negative sentiment about Spectrum and repeated service failures: she says she is ""pissed off at spectrum"" and that ""they went to spectrum. Nothing but problems"" indicating long-term dissatisfaction ('That's all you guys ever. Don't take this personal. I'm pissed off at spectrum.'; 'I've had nothing but a problem since they went to spectrum. Nothing but problems.') [27,29]. She uses highly negative language toward the company, calling them ""greedy little bastards,"" which shows active hostility that would likely deter others ('God you not you spectrum is greedy little bastards.'; 'I Hope you're recording this we're greedy little bastards') [40,42]. Her complaint is focused and actionable — unexpected fees for paying by phone and paper statement charges that she says were not disclosed, and she insists these should be removed ('When you make a payment with a person over the phone ... they charge a $5.00 fee?' and 'they should take the $5.00 off because she didn't do her Job and they should take the $2.00 off because i never received it') [45,55]. The agent explains they lack authorization to remove the fees and only can escalate to a lead, which suggests her issue may remain unresolved immediately ('OK i don't have authorization to remove that ... i can get you to a lead') [56]. Taken together — repeated service problems, strong insults, and an unresolved billing dispute — the caller will very likely recommend against Spectrum after the call, so she is classified as a Detractor with a score of 1. [27,29,40,42,45,55,56,69,111]."" ,
  ",calibrated,calibrated,12,12,False,2211,3.32,,
95,B872BE29A82FD348AB329F31CF9D22FC,5,"Negative: [turn 22, 31] - agent should be more polite while informing about payment, no empathy observed should have been more polite. | Positive: [turn 17] Agent informed that payment is processing and suggested to contact their bank and asking them to stop the payment. Agent informed that we haven't received the payment and they had to contact the bank. Lack of Empathy was observed.",1,"Detractor: [turns 8, 10] - Customer was highly upset and said i talk to agent and ask to make $50 payment, he called me back and said he took whole $145 payment due to which my other payment s got stuck Detractor: [turns 21] - customer highly angry and said i am going to put lawsuit against Detractor: [turns 23, 26, 32] - also abusive on the call. | Detractor: [turns 8, 10, 11, 12] Cx was highly dis-satisfied as previous agent mistakenly processed the full payment, which was due on the account, cx asked to process the partial payment, now cx wants their money back as they overdue and need to pay $200. Turn-18 Cx said that Spectrum cause a problem. Customer was abusive during the conversation. | Customer was calling that previous agent took the whole payment and then informed that he would deposit that back to account. Customer further mentioned that he got overdue payment of $210. Customer was very upset and wanted his money back. Agent informed that customer need to call his bank to stop the payment. Customer kept cursing.",5,Neutral,"Agent authenticated the customer and clearly explained the situation and next steps, noting ""I see $145.00 and $76 payments that is processing right now"" and advising to ""call your bank and telling them to stop that payment"" ('I see $145.00 and $76 payments that is processing right now.'; 'call your bank and telling them to stop that payment'). The agent stated limitations and timing, saying a return would take ""six to seven business days"" if submitted, which correctly set expectations ('it would take six to seven business days to go back to your account'). The agent remained professional asking to ""keep it professional"" but did not proactively offer to submit a reversal or alternative assistance beyond instructing the customer to contact their bank, which keeps this interaction in the adequate but mixed category ('Uh, let's keep it professional, ma'am.'; 'We wouldn't be able to do that... You would have to call your bank'). Overall the handling was competent and within likely jurisdictional limits but not notably empathetic or ownership-taking, so a neutral score is appropriate ('I do appreciate you reaching out today and let me assist with your concern').",2,Detractor,"The caller is strongly negative about Spectrum after an apparently incorrect withdrawal and an unresolved refund. They repeatedly describe financial harm and demand immediate resolution: 'I got a $210.00 goddamn overdue payment that is due to be paid' (8) and 'Spectrum took out $145.00' (9). The caller insists 'I need my money back on my account right now' (11) and threatens legal action: 'I'm gonna put a lawsuit in you guys' (21). The agent is unable to provide an immediate fix and directs the caller to their bank: 'I would suggest calling your bank and telling them to stop that payment' (17) and 'Even if we submitted a ticket... it would take six to seven business days' (29), which likely increases dissatisfaction. The caller uses profanity at the agent, signaling strong anger toward the company: 'You mother fucking bitch, you do it bitch.' (32). Overall, if this call reflects the outcome, it would detract from Spectrum (score 2). Citations: 'I got a $210.00 goddamn overdue payment that is due to be paid' (8); 'Spectrum took out $145.00' (9); 'I need my money back on my account right now' (11); 'I'm gonna put a lawsuit in you guys' (21); 'Why? Because you made the fuck up.' (23); 'I would suggest calling your bank and telling them to stop that payment' (17); 'it would take six to seven business days' (29); 'You mother fucking bitch, you do it bitch.' (32).",calibrated,calibrated,5,5,False,921,3.32,,
96,BBAA343872A9C44692EFA8DD901F569D,3,"Interrupting the caller (“I was talking, go ahead,” seq. 22) undermined professionalism.
Failed to show empathy or acknowledge the customer’s frustration.
Did not attempt escalation or offer alternative resolution paths.
Closing was perfunctory and inappropriate given the customer’s hostility (“I hope you have a great rest of your day,” seq. 40).
Overall, the agent followed process but did not de-escalate or manage the customer’s anger, leaving the situation worse. | Agent was able to explain the bill outstanding the the reason it was past due, was not able to handle the customer and kept repeating about the process that cannot cancel till the past due is paid, this aggregated the customer more, no empathy observed",2,"Detractor: [turns 23, 29, 32] Customer is irate because as per him he doesn't owe any amount and has wasted 12 hours on this issue and wants to close his account | The caller became hostile, saying he had “12 hours into this” and wanted to cancel the account (seq. 29).
He accused Spectrum of lying and refused to pay further (seq. 32, 39).
The call ended unresolved, with the customer angry and intent on leaving Spectrum. | Detractor: [turns 23] Customer not happy as do not agree with the past due balance, Detractor: [turns 29, 32] Customer was furious and wanted to cancel, feels he was lied to,",5,Neutral,"The agent correctly explained the billing outcome and why the seasonal setup did not remove the remaining balance ('your balance was 12890 as of March 18th' / 'All you paid was the past due') (15, 17-18, 24). The agent communicated the system limitation about closing while service interruption and past due amounts ('We can't close it while there's a past due balance and a service interruption') (30, 34, 36-38). However, the agent missed opportunities for stronger empathy and de-escalation when the caller became upset and accused the company of lying; the final sign-off was abrupt and did not attempt to calm or offer alternatives ('You lied to me...'; 'I Hope you have a great rest of your day') (39-40). Given correct information but limited rapport and no resolution, this aligns with an adequate but mixed handling. ",2,Detractor,"The caller expresses clear, ongoing anger and intent to stop doing business with Spectrum: they demand account cancellation ('Just cancel the account. We don't want to do Business with you anymore.') (29) and declare refusal to pay further ('We're not going to pay anymore.' ) (32). They explicitly accuse Spectrum of dishonesty ('You lied to me') (39), citing prior assurance that the account was current ('She assured me it was current so I don't owe the $89.00. Please take that off and we'll continue.') (23). The agent confirms the balance and explains why the charge remained, but the caller remains hostile and ends the call stating 'We're done.' (39), indicating a strong negative, brand-damaging stance after the interaction. (Agent explanations of billing do not resolve the caller's dissatisfaction: 'Your remaining balance at the time of that payment was 6895.' ) (18). Overall, if shared publicly this call would detract from Spectrum. (Citations: 23, 29, 32, 39, 18).",calibrated,calibrated,6,6,False,1063,3.32,,
97,BF3829C6B93EFA45A08D9C7645A1DF6B,8,"Positive: [turns 52, 82] Agent clearly explained the breakup of the bill and also sent the emails that the customer claims not to have received | Customer was calling about the phone service as it was shut off. Agent educated customer that in order to get the phone service running customer needed to make payment for the past due. Agent listened to the customer patiently. Agent was professional even when customer was cursing. Agent understood the customer's request and showed empathy.",0,"Customer expressed anger and hostility, showing severe dissatisfaction with service.” Customer escalated with abusive remarks, reflecting severe dissatisfaction and anger.” Customer repeatedly disputed her bills however issue has never been resolved. Caller left extremely dissatisfied. | Detractor: [turns 4, 7] Cx seems unhappy as their phone had been disconnected. Turn-89 Customer complained about the last agent. Turn-127 Cx wanted their phone service back and said their bill is freaking $50. Turn 132 - cx complained that Spectrum person told them it is for free however they were charged for it, Turn -134- Cx don't want to pay their bill. Turn-139 Customer was highly distressed with their increased bill. Cx was abusive on call and seems highly distressed with the bill. | Customer was calling about his phone service and the bill. Customer was very frustrated and wanted the phone service to be turned on. Agent educated customer about the balance on the account. Customer said that he doesn't have money. Customer was upset throughout the call and kept cursing.",6,Neutral,"The agent stayed calm, professional, and completed identity verification and a security-code reset successfully ('that was successful' and '1225 is going to get you into your account') demonstrating competent execution of tasks. The agent clearly explained limitations of their system and policy, including that 'it is an automated system' and 'the only way to get your phone on is that past due balance has to be zeroed out', which accurately set expectations but could not resolve the customer's immediate outage. The agent attempted helpful alternatives (resending billing emails and offering a downgrade for the next cycle) and asked the caller to remain professional when responses became abusive ('If you'd like me to help you, you need to like, stay professional'), showing ownership of the interaction within scope. Because the core billing/service interruption remained unresolved due to policy and automation rather than agent failure, this is solid, routine handling but not clearly above standard, so a neutral/6 score is appropriate. ('I just resent that' and 'when whenever we downgrade ... it starts the downgrade for the next billing cycle')",2,Detractor,"The caller ends the call highly negative and hostile toward Spectrum, indicating a strong negative view after the interaction. He repeatedly expresses that he feels misled about pricing: ('I had a fiber gig, Wi-Fi in the house for $35 a month and the freaking Spectrum person told me... it's free for a year') (lines 132-133). He reports acute financial stress and need for service but policy blocked an immediate remedy: ('I don't have money until Wednesday, so.' / 'the only way to get your phone on is that past due balance has to be zeroed out') (lines 218, 125-126). The caller uses profanity and directly attacks the company/agent, showing strong anger: ('Oh we can't help you, Fuck you. Fuck your past due bill and your auto pay shit.') (line 194-195). He also threatens to escalate and emphasizes being repeatedly let down: ('we have everything we need to prove that I've been fucked') (line 241) and ('Where's my respect? ... You, you fucking pissed me off. Fuck it, I don't even care.') (lines 252-255). Although the agent was calm and provided explanations and limited options, the immediate problem (service restoration/credit) remained unresolved, and the caller expressed clear intent to be dissatisfied and possibly spread negative word-of-mouth—meeting the rubric's description of a Detractor with strong negative sentiment. (Cited evidence supports the unresolved policy limitation: 'there's nothing I can do...it is an automated system' (lines 226-227).) Overall, if this call were shared, it would detract from Spectrum's reputation, so I rate it a 2 (strong negative sentiment). (All claims grounded in cited transcript lines.)

Cited lines: (lines referenced inline above).",calibrated,calibrated,13,18,True,5827,3.32,,
